{
  "$schema": "../schema/story.schema.json",
  "formatVersion": 1,
  "id": "huaqiang-melon-story",
  "title": "华强买瓜：无限世界线",
  "description": "可由多人协作编辑的主剧情、站位与表情数据。",
  "entryNodeId": "arrival",
  "canonRoute": [
    "arrival",
    "ask_price",
    "pick_melon",
    "guarantee",
    "weigh_melon",
    "reveal_magnet",
    "cut_melon",
    "vendor_confronts",
    "hao_fall_1",
    "hao_injured",
    "canon_exit"
  ],
  "characters": {
    "HUAQIANG": {
      "displayName": "华强",
      "initialPosition": {
        "column": 4,
        "row": 22
      },
      "defaultExpression": "idle",
      "expressions": {
        "idle": {
          "pose": "idle",
          "animation": "breathe"
        },
        "talk": {
          "pose": "talk",
          "animation": "talk",
          "mouth": {
            "left": { "x": 35, "y": 18 },
            "right": { "x": 65, "y": 18 },
            "width": 4,
            "height": 2,
            "color": "#3b1716",
            "openColor": "#12090a",
            "intervalMs": 150
          }
        },
        "watch": {
          "pose": "watch",
          "animation": "breathe"
        },
        "weigh": {
          "pose": "weigh",
          "animation": "interact"
        },
        "reveal": {
          "pose": "reveal",
          "animation": "interact"
        },
        "cut": {
          "pose": "cut",
          "animation": "action"
        },
        "threaten": {
          "pose": "threaten",
          "animation": "shake"
        },
        "strike": {
          "pose": "strike",
          "animation": "action"
        },
        "fall": {
          "pose": "fall",
          "animation": "fall"
        },
        "injured": {
          "pose": "injured",
          "animation": "none"
        },
        "leave": {
          "pose": "leave",
          "animation": "walk"
        }
      }
    },
    "HAO_GE": {
      "displayName": "郝哥",
      "initialPosition": {
        "column": 19,
        "row": 15
      },
      "defaultExpression": "idle",
      "expressions": {
        "idle": {
          "pose": "idle",
          "animation": "breathe",
          "sprites": {
            "left": "/assets/generated/sprites/vendor_left.png",
            "right": "/assets/generated/sprites/vendor_right.png"
          }
        },
        "talk": {
          "pose": "talk",
          "animation": "talk",
          "sprites": {
            "left": "/assets/generated/sprites/vendor_left.png",
            "right": "/assets/generated/sprites/vendor_right.png"
          },
          "mouth": {
            "left": { "x": 45, "y": 20 },
            "right": { "x": 55, "y": 20 },
            "width": 4,
            "height": 2,
            "color": "#421c18",
            "openColor": "#16090a",
            "intervalMs": 170
          }
        },
        "watch": {
          "pose": "watch",
          "animation": "breathe",
          "sprites": {
            "left": "/assets/generated/sprites/vendor_left.png",
            "right": "/assets/generated/sprites/vendor_right.png"
          }
        },
        "weigh": {
          "pose": "weigh",
          "animation": "interact",
          "sprites": {
            "left": "/assets/generated/sprites/vendor_left.png",
            "right": "/assets/generated/sprites/vendor_right.png"
          }
        },
        "threaten": {
          "pose": "threaten",
          "animation": "shake",
          "sprites": "/assets/generated/sprites/hao_angry.png"
        },
        "strike": {
          "pose": "strike",
          "animation": "action",
          "sprites": "/assets/generated/sprites/hao_angry.png"
        },
        "fall": {
          "pose": "fall",
          "animation": "fall8"
        },
        "injured": {
          "pose": "injured",
          "animation": "none",
          "sprites": "/assets/generated/sprites/hao_injured.png"
        },
        "leave": {
          "pose": "leave",
          "animation": "walk"
        }
      }
    },
    "NEIGHBOR": {
      "displayName": "隔壁摊主",
      "initialPosition": {
        "column": 24,
        "row": 14
      },
      "defaultExpression": "idle",
      "expressions": {
        "idle": {
          "pose": "idle",
          "animation": "breathe",
          "sprites": {
            "left": "/assets/generated/sprites/neighbor_left.png",
            "right": "/assets/generated/sprites/neighbor_right.png"
          }
        },
        "talk": {
          "pose": "talk",
          "animation": "talk",
          "sprites": {
            "left": "/assets/generated/sprites/neighbor_left.png",
            "right": "/assets/generated/sprites/neighbor_right.png"
          },
          "mouth": {
            "left": { "x": 34, "y": 23 },
            "right": { "x": 66, "y": 23 },
            "width": 4,
            "height": 2,
            "color": "#401a18",
            "openColor": "#14090a",
            "intervalMs": 165
          }
        },
        "watch": {
          "pose": "watch",
          "animation": "breathe",
          "sprites": {
            "left": "/assets/generated/sprites/neighbor_left.png",
            "right": "/assets/generated/sprites/neighbor_right.png"
          }
        }
      }
    }
  },
  "nodes": [
    {
      "id": "arrival",
      "chapter": "一 · 街口",
      "speaker": "HUAQIANG",
      "narration": "摩托声在街口停下。华强抬眼望去，瓜摊、台秤和守在摊后的郝哥都在前方。",
      "stageDirection": "请选择华强接下来走向哪里。",
      "stage": {
        "playerPlacement": {
          "at": {
            "column": 4,
            "row": 22
          }
        },
        "characters": {
          "HUAQIANG": {
            "expression": "idle"
          },
          "HAO_GE": {
            "expression": "watch"
          }
        }
      },
      "choices": [
        {
          "id": "A",
          "label": "径直走到瓜摊",
          "description": "沿经典路线来到郝哥右侧。",
          "next": "ask_price",
          "canonical": true,
          "tensionDelta": 2
        },
        {
          "id": "B",
          "label": "先看路边价牌",
          "description": "从标价和摊位陈设入手。",
          "next": "inspect_sign",
          "canonical": false,
          "tensionDelta": 0
        },
        {
          "id": "C",
          "label": "先去停好摩托",
          "description": "绕到街边空地再观察。",
          "next": "park_bike",
          "canonical": false,
          "tensionDelta": -1
        }
      ]
    },
    {
      "id": "inspect_sign",
      "chapter": "支线 · 价牌",
      "speaker": "HUAQIANG",
      "narration": "华强在价牌前停了片刻。墨迹像是刚补过，摊位上却找不到净重和称重规则。",
      "stageDirection": "郝哥已经注意到这边。",
      "stage": {
        "playerPlacement": {
          "at": {
            "column": 11,
            "row": 13
          },
          "face": {
            "position": {
              "column": 12,
              "row": 13
            }
          }
        },
        "characters": {
          "HUAQIANG": {
            "expression": "watch"
          },
          "HAO_GE": {
            "expression": "watch"
          }
        }
      },
      "choices": [
        {
          "id": "A",
          "label": "拿价牌去问郝哥",
          "description": "带着疑点走到秤前。",
          "next": "ask_price",
          "canonical": false,
          "tensionDelta": 4
        },
        {
          "id": "B",
          "label": "绕到秤盘侧面",
          "description": "先寻找称重装置的破绽。",
          "next": "early_scale_check",
          "canonical": false,
          "tensionDelta": 6
        },
        {
          "id": "C",
          "label": "招呼隔壁摊主",
          "description": "让旁人作证后再开口。",
          "next": "ask_neighbor",
          "canonical": false,
          "tensionDelta": 1
        }
      ]
    },
    {
      "id": "park_bike",
      "chapter": "支线 · 街边",
      "speaker": "NEIGHBOR",
      "narration": "华强把摩托停到街边。隔壁摊主朝瓜摊瞥了一眼，随即低头整理自己的货物。",
      "stageDirection": "这条街上的人似乎都认识郝哥。",
      "stage": {
        "playerPlacement": {
          "at": {
            "column": 26,
            "row": 8
          },
          "face": {
            "position": {
              "column": 25,
              "row": 7
            }
          }
        },
        "characters": {
          "HUAQIANG": {
            "expression": "watch"
          },
          "NEIGHBOR": {
            "expression": "watch"
          }
        }
      },
      "choices": [
        {
          "id": "A",
          "label": "不多问，走向瓜摊",
          "description": "把注意力放回买瓜。",
          "next": "ask_price",
          "canonical": false,
          "tensionDelta": 1
        },
        {
          "id": "B",
          "label": "问问这摊的口碑",
          "description": "先了解以前有没有短秤。",
          "next": "ask_neighbor",
          "canonical": false,
          "tensionDelta": 0
        },
        {
          "id": "C",
          "label": "换到街口另一侧",
          "description": "保持距离继续观察。",
          "next": "watch_from_afar",
          "canonical": false,
          "tensionDelta": -2
        }
      ]
    },
    {
      "id": "ask_neighbor",
      "chapter": "支线 · 旁证",
      "speaker": "NEIGHBOR",
      "narration": "隔壁摊主压低声音提醒一句，目光始终避开郝哥，话说完便转身忙活。",
      "dialogue": "买瓜得当面称清、当面切开。别的我不多说。",
      "stageDirection": "这句提醒可以改变接下来的处理方式。",
      "stage": {
        "playerPlacement": {
          "at": {
            "column": 23,
            "row": 14
          },
          "face": {
            "character": "NEIGHBOR"
          }
        },
        "characters": {
          "NEIGHBOR": {
            "expression": "talk"
          },
          "HUAQIANG": {
            "expression": "watch"
          }
        }
      },
      "choices": [
        {
          "id": "A",
          "label": "照常问价",
          "description": "不暴露已经得到的提醒。",
          "next": "ask_price",
          "canonical": false,
          "tensionDelta": 2
        },
        {
          "id": "B",
          "label": "直接要求复秤",
          "description": "跳过试探，先核对重量。",
          "next": "demand_reweigh",
          "canonical": false,
          "tensionDelta": 8
        },
        {
          "id": "C",